"lienreference","OutilFinancement","Acronyme","Tutelle","Debut","Duree","MontantEquipe","MontantTotal","typeColla","Coordinateur","Responsablescientifique","Participantsequipe","Partenaires","Nomducontrat","Motscles","Resume"
"slp","CIFRE","CRC Services","IMTA","05/19",36,45000,45000,"R\&D","O. Péton","O. Péton","G. Soleilhac, O. Péton, F. Lehuédé","CRC Services","Thèse CIFRE Gauthier Soleilhac, Transport de marchandises dans un réseau logistique avec sous-traitance : une optimisation orientée chargeurs","Optimisation des transports, mutualisation","L'objectif de la thèse est de proposer des algorithmes d'optimisation des transports adaptés à une perspective chargeur. L'enjeu scientifique est d'intégrer les coûts et contraintes métiers liés à la sous-traitance du transport dans différentes situations : dans le cadre d'une activité mono-entreprise; et dans le cadre d'une collaboration entre chargeurs pour optimiser leurs transports."
"slpnavalgroup","CRI","Naval Group ","IRT Jules Verne","12/18",36,30000,120000,"R\&D","IRT Jules Verne","A. Dolgui","A. Dolgui, S. Thevenin","Naval group, IRT","Pipe smArt faCtory of the futurE (PACE)",,
"slp","CIFRE","VIF","IMTA","11/18",36,45000,45000,"R\&D","O. Bellenguez","O. Bellenguez","F. Laroche, O. Bellenguez, G. Massonnet","VIF","Méthodes d'optimisation PDP","planification de production, lot-sizing, périssabilité, set-up","Optimisation du plan de production de produits périssables dans un contexte multi-ressources à capacité finie et taille de lot fixe"
"slpgemedical","CRI","GE MEDICAL SYSTEMS","IMT Atlantique","01/17",12,35000,70000,"R\&D","LS2N","D. Lemoine","D. Lemoine","GE MEDICAL SYSTEMS","Thèse GE Medical .","Chaine logistique de pieces de rechange, Machine learning.","Contrat supportant la thèse d'Hamza El Garrab"
"slp","CIFRE","LUMIPLAN","IMTA","01/16",36,45000,45000,"R\&D","F. Lehuédé","F. Lehuédé","K.Y. Lee, F. Lehuédé, T. Yeung","Lumiplan","Thèse CIFRE Ka Yu Lee, Conception et reconfiguration d'un réseau de bus en présence de données incomplètes","Transport de passagers ; conception de réseau","L’objectif est de proposer des méthodes d’aide à la décision et d’optimisation pour supporter la conception d’un réseau de bus urbain. Le projet cible des territoires en développement (l’Inde en particulier), où les réseaux sont aujourd’hui peu structurés et les informations démographiques ne sont pas accessibles. Le sujet de la thèse porte sur la proposition de modèles et algorithmes pour permettre l’identification de la demande à partir de l’analyse de traces GPS ainsi que sur la conception optimisée du réseau."
"slp","CIFRE","Brangeon","IMTA","2014",36,30000,30000,"R\&D","N. Bostel","N. Bostel","N. Bostel, P. Dejax, T. Yeung, Q. Tonneau","Brangeon","Thèse CIFRE Q. Tonneau, optimisation de la chaîne logistique des déchets non dangereux.","Optimisation de la chaine logistique ; déchets non dangereux","Contrat d'encadrement de la thèse CIFRE de Quentin Tonneau ayant pour sujet l'optimisation de la chaîne logistique des déchets non dangereux."
"slp4snetwork","CRI","4S Network","IMT Atlantique","10/13",36,117000,117000,"R\&D","IMT Atlantique","F. Lehuédé","F. Lehuédé, O. Péton","4S Network","Thèse 4S-Network","chaînes logistiques ; mutualisation","Contrat supportant la thèse de Juliette Médina. L’objectif est de développer des algorithmes de construction de tournées et planification de chargements. Le contexte est celui de la mutualisation de la distribution des plateformes de la grande distribution entre plusieurs producteurs via des hubs logistiques. Ces algorithmes seront intégrés aux outils de la société 4S-Network en aide à la décision lors d’expertises logistiques ou pour optimiser le futur réseau logistique mutualisé en cours de déploiement par cette société."
