"Intitule","url","Porteur","Participants","motsclefs","resume"
"hencher","hencher.ls2n.fr","AeLoS / Attiogbé","AeLoS","Modélisation, Systèmes embarqués, Event-B","Une plateforme de génération de modèles formels B, à partir d'une description de l'interface d'un système de contrôle."
"MCpMC",,"Delahaye/Fournier","Ardourel, Fournier, Delahaye, RAN, Kamma","Modèles probabilistes, model checking statistique","Outil de modélisation et de vérification de systèmes paramétrés. L'outil implante le model checking statistique et produit comme résutat un polynôme à l'aide de ses paramètres d'entrée, au lieu d'une valeur booléenne."
"Aziza",,"Attiogbé","AeLoS","Modèles hétérogènes - Composition","Un prototype de modélisation de systèmes hétérogènes ; le prototype est basé sur la composition de processus décrit via des formalismes comme Promela,Uppal, LTS"
"Tila2B",,"Attiogbé","AeLoS","Moèle formel générique paramétré, IoT, Event-B, propriétés invariantes","Nous avons défini un modèle générique et paramétré pour analyser les propriétés architecturales invariantes des systèmes de contrôle d'objets IoT. Un mini-langage permet de décrire ces systèmes àa base d'IoT. Tila2B est un prototype qui transforme le système décrit avec Tila en modèle Event-B analysable avec la plateforme Rodin."
"CostoTest","https://costo.univ-nantes.fr/","Ardourel/André","AeLoS, Mottu","Test de modèles de composants logiciels sûrs","Extension de la plateforme Costo au test de modèles. Création de harnais de tests formant des applications (à part entière) pour tester unitairement , en intégration ou en recette des modèles composants logiciels multi-facette."
